{"id":"complete-login-required-block","label":"Complete login required block","target":{"generatorType":"woocommerce","generatorPage":"checkout","generatorArea":"state-login"},"content":[{"id":"548040","name":"block","parent":"afpcux","children":["ad643c","b44057"],"settings":{"_alignItems":"stretch","_rowGap":"1rem"},"label":"Login content"},{"id":"ad643c","name":"woocommerce-notice","parent":"548040","children":[],"settings":{"previewType":"notice"},"label":"WooCommerce notice"},{"id":"b44057","name":"woocommerce-account-login-form","parent":"548040","children":["0a7f6a","1469c5","d94922","08dac6","f19e48","bd1cf6","12d552","600b0f","eed167"],"settings":{"_alignItems":"stretch","_rowGap":"1rem"},"label":"Login form"},{"id":"0a7f6a","name":"heading","parent":"b44057","children":[],"settings":{"text":"Login"}},{"id":"1469c5","name":"text-basic","parent":"b44057","children":[],"settings":{"text":"{do_action:woocommerce_login_form_start}"},"label":"woocommerce_login_form_start"},{"id":"d94922","name":"woocommerce-form-field","parent":"b44057","children":[],"settings":{"fieldSource":"accountLogin","fieldKey":"username","label":"Username or email address"},"label":"Login: Username or email"},{"id":"08dac6","name":"woocommerce-form-field","parent":"b44057","children":[],"settings":{"fieldSource":"accountLogin","fieldKey":"password","label":"Password"},"label":"Login: Password"},{"id":"f19e48","name":"text-basic","parent":"b44057","children":[],"settings":{"text":"{do_action:woocommerce_login_form}"},"label":"woocommerce_login_form"},{"id":"bd1cf6","name":"form-checkbox","parent":"b44057","children":[],"settings":{"wooFields":"accountLoginRememberMe","text":"Remember me"},"label":"Remember me"},{"id":"12d552","name":"woocommerce-form-submit","parent":"b44057","children":[],"settings":{"formType":"login","buttonText":"Log in"},"label":"Log in"},{"id":"600b0f","name":"text-basic","parent":"b44057","children":[],"settings":{"text":"<a href=\"{woo_url:lost-password}\">Lost your password?</a>","_cssClasses":"woocommerce-LostPassword lost_password"},"label":"Lost password link"},{"id":"eed167","name":"text-basic","parent":"b44057","children":[],"settings":{"text":"{do_action:woocommerce_login_form_end}"},"label":"woocommerce_login_form_end"}]}