{"id":"complete-addresses-block","label":"Complete addresses block","target":{"generatorType":"woocommerce","generatorPage":"myaccount","generatorArea":"state-addresses"},"content":[{"id":"1c2712","name":"woocommerce-notice","parent":"ozvoqr","children":[],"settings":{"previewType":"all"}},{"id":"40c6f1","name":"text-basic","parent":"ozvoqr","children":[],"settings":{"text":"{woo_account_addresses_description}","tag":"p"},"label":"Addresses description"},{"id":"5f6279","name":"block","parent":"ozvoqr","children":["7901cc"],"settings":{"_display":"grid","_gridGap":"1rem","_gridTemplateColumns":"1fr 1fr","_gridTemplateColumns:mobile_portrait":"1fr","_margin":{"top":"1rem"},"_padding":{"bottom":"1rem"}},"label":"Address list"},{"id":"7901cc","name":"block","parent":"5f6279","children":["6ab4ea","5be11d","e8fd27"],"settings":{"hasLoop":true,"query":{"objectType":"wooAccountAddresses"},"_alignItems":"stretch","_padding":{"top":"1rem","right":"1rem","bottom":"1rem","left":"1rem"},"_rowGap":"1rem","_background":{"color":{"raw":"hsl(0, 0%, 98%)"}}},"label":"Addresses loop"},{"id":"6ab4ea","name":"div","parent":"7901cc","children":["dd5376","04dfca"],"settings":{"_display":"flex","_justifyContent":"space-between","_alignItems":"center","_columnGap":"1rem","_rowGap":"0.5rem","_flexWrap":"wrap"},"label":"Address header"},{"id":"dd5376","name":"heading","parent":"6ab4ea","children":[],"settings":{"text":"{woo_account_address_title}","tag":"h3"},"label":"Address title"},{"id":"04dfca","name":"button","parent":"6ab4ea","children":[],"settings":{"text":"{woo_account_address_action_label}","style":"dark","link":{"type":"external","url":"{woo_account_address_edit_url}"}},"label":"Address action"},{"id":"5be11d","name":"text-basic","parent":"7901cc","children":[],"settings":{"text":"{woo_account_address}","tag":"address"},"label":"Address"},{"id":"e8fd27","name":"text-basic","parent":"7901cc","children":[],"settings":{"text":"{do_action:woocommerce_my_account_after_my_address}"},"label":"woocommerce_my_account_after_my_address"}]}