{"id":"complete-orders-block","label":"Complete orders block","target":{"generatorType":"woocommerce","generatorPage":"myaccount","generatorArea":"state-orders"},"content":[{"id":"91001a","name":"woocommerce-notice","children":[],"settings":{"previewType":"all"},"parent":"f91fc8"},{"id":"660dd0","name":"text-basic","children":[],"settings":{"text":"{do_action:woocommerce_before_account_orders}"},"label":"woocommerce_before_account_orders","parent":"f91fc8"},{"id":"9df595","name":"block","children":["b3a086"],"settings":{"_conditions":[[{"id":"gbwxek","key":"dynamic_data","dynamic_data":"{query_results_count:b3a086}","compare":">","value":"0"}]],"_display":"grid","_gridGap":"1rem","_gridTemplateColumns":"1fr 1fr","_gridTemplateColumns:mobile_portrait":"1fr","_margin":{"top":"1rem"},"_padding":{"bottom":"1rem"}},"label":"Order list","parent":"f91fc8"},{"id":"b3a086","name":"block","children":["c80b8d","d0a807"],"settings":{"hasLoop":true,"query":{"objectType":"wooAccountOrders"},"_direction":"row","_padding":{"top":"1rem","right":"1rem","bottom":"1rem","left":"1rem"},"_columnGap":"1rem","_rowGap":"2rem","_background":{"color":{"raw":"hsl(0, 0%, 98%)"}},"_flexWrap":"wrap"},"label":"Orders loop","parent":"9df595"},{"id":"c80b8d","name":"block","children":["e1550c","ea8719","1e7279","0aabf8","587244"],"settings":{"_position":"relative"},"label":"Order meta","parent":"b3a086"},{"id":"e1550c","name":"text-basic","children":[],"settings":{"text":"Order number: <b>#{woo_order_number}</b>"},"label":"Order number","parent":"c80b8d"},{"id":"ea8719","name":"text-basic","children":[],"settings":{"text":"Order date: <b>{woo_order_date:j M Y}</b>"},"label":"Order date","parent":"c80b8d"},{"id":"1e7279","name":"text-basic","children":[],"settings":{"text":"{woo_order_status}","_border":{"radius":{"top":"50","right":"50","bottom":"50","left":"50"}},"_background":{"color":{"raw":"hsl(0, 0%, 89%)"}},"_padding":{"left":"1rem","right":"1rem"},"_position":"absolute","_right":"0","_top":"0","tag":"custom","customTag":"small"},"label":"Order status","parent":"c80b8d"},{"id":"0aabf8","name":"text-basic","children":[],"settings":{"text":"Total items: <b>{woo_order_item_count}</b>"},"label":"Order item count","parent":"c80b8d"},{"id":"587244","name":"text-basic","children":[],"settings":{"text":"Total amount: <b>{woo_order_total}</b>"},"label":"Order total","parent":"c80b8d"},{"id":"d0a807","name":"block","children":["46a433"],"settings":{"query":{"objectType":"wooAccountOrderActions"},"hasLoop":true,"_width":"auto"},"label":"Order actions loop","parent":"b3a086"},{"id":"46a433","name":"button","children":[],"settings":{"text":"{woo_order_action_name}","style":"dark","link":{"type":"external","url":"{woo_order_action_url}","ariaLabel":"{woo_order_action_aria_label}"}},"label":"Order action","parent":"d0a807"},{"id":"3a8226","name":"text-basic","children":[],"settings":{"text":"{do_action:woocommerce_before_account_orders_pagination}"},"label":"woocommerce_before_account_orders_pagination","parent":"f91fc8"},{"id":"8be727","name":"woocommerce-account-orders-pagination","children":[],"settings":{"queryId":"b3a086"},"label":"Orders pagination","parent":"f91fc8"},{"id":"48778e","name":"block","children":["3b2234","84aff0"],"settings":{"_conditions":[[{"id":"noord","key":"dynamic_data","dynamic_data":"{query_results_count:b3a086}","compare":"==","value":"0"}]],"_padding":{"top":"1rem","right":"1rem","bottom":"1rem","left":"1rem"}},"label":"Empty orders","parent":"f91fc8"},{"id":"3b2234","name":"text-basic","children":[],"settings":{"text":"No order has been made yet."},"label":"Empty message","parent":"48778e"},{"id":"84aff0","name":"button","children":[],"settings":{"text":"Browse products","style":"primary","link":{"type":"external","url":"{woo_url:shop}"}},"label":"Browse products","parent":"48778e"},{"id":"fd6533","name":"text-basic","children":[],"settings":{"text":"{do_action:woocommerce_after_account_orders}"},"label":"woocommerce_after_account_orders","parent":"f91fc8"}]}