{"id":"complete-lost-password-confirmation-block","label":"Complete lost password confirmation block","target":{"generatorType":"woocommerce","generatorPage":"myaccount","generatorArea":"state-lost-password-confirmation"},"content":[{"id":"yelmip","name":"text-basic","parent":"pmqbry","children":[],"settings":{"text":"{do_action:woocommerce_before_lost_password_confirmation_message}"},"label":"woocommerce_before_lost_password_confirmation_message"},{"id":"khdath","name":"text-basic","parent":"pmqbry","children":[],"settings":{"text":"A password reset email has been sent to the email address on file for your account, but may take several minutes to show up in your inbox. Please wait at least 10 minutes before attempting another reset."},"label":"Confirmation message"},{"id":"hnosce","name":"text-basic","parent":"pmqbry","children":[],"settings":{"text":"{do_action:woocommerce_after_lost_password_confirmation_message}"},"label":"woocommerce_after_lost_password_confirmation_message"}]}