{"id":"checkout-fields-shipping","label":"Checkout fields shipping","target":{"generatorType":"woocommerce","generatorPage":"checkout","generatorArea":"state-checkout"},"content":[{"id":"1ea0b0","name":"block","parent":"ipioeb","children":["227673","72359e","662efb","jklwty","29aae0"],"settings":{"_alignItems":"stretch","_margin":{"top":"1rem"},"_conditions":[[{"key":"woo_checkout_needs_shipping_address","compare":"==","value":"1"}]],"_rowGap":"1rem"},"label":"Shipping"},{"id":"227673","name":"heading","parent":"1ea0b0","children":[],"settings":{"text":"Shipping details"}},{"id":"72359e","name":"woocommerce-shipping-options","parent":"1ea0b0","children":[],"settings":{},"label":"Shipping options"},{"id":"662efb","name":"form-checkbox","parent":"1ea0b0","children":[],"settings":{"wooFields":"shipAddress"},"label":"Ship to another address"},{"id":"jklwty","name":"woocommerce-checkout-shipping-address","parent":"1ea0b0","children":["735be2","2372f2","dcecf1","595d6f","6d4f5e","18704b","17ed2f","3be310","015de0","c383d3"],"settings":{}},{"id":"735be2","name":"text-basic","parent":"jklwty","children":[],"settings":{"text":"{do_action:woocommerce_before_checkout_shipping_form}"},"label":"woocommerce_before_checkout_shipping_form"},{"id":"2372f2","name":"text-basic","parent":"jklwty","children":[],"settings":{"text":"{do_action:woocommerce_checkout_shipping}"},"label":"woocommerce_checkout_shipping"},{"id":"dcecf1","name":"woocommerce-form-field","parent":"jklwty","children":[],"settings":{"fieldKey":"shipping_first_name","label":"First name","placeholder":"First name"},"label":"Shipping: First name"},{"id":"595d6f","name":"woocommerce-form-field","parent":"jklwty","children":[],"settings":{"fieldKey":"shipping_last_name","label":"Last name","placeholder":"Last name"},"label":"Shipping: Last name"},{"id":"6d4f5e","name":"woocommerce-form-field","parent":"jklwty","children":[],"settings":{"fieldKey":"shipping_country","label":"Country / Region","placeholder":"Country / Region"},"label":"Shipping: Country / Region"},{"id":"18704b","name":"woocommerce-form-field","parent":"jklwty","children":[],"settings":{"fieldKey":"shipping_address_1","label":"Street address","placeholder":"House number and street name"},"label":"Shipping: Street address"},{"id":"17ed2f","name":"woocommerce-form-field","parent":"jklwty","children":[],"settings":{"fieldKey":"shipping_city","label":"Town / City","placeholder":"Town / City"},"label":"Shipping: Town / City"},{"id":"3be310","name":"woocommerce-form-field","parent":"jklwty","children":[],"settings":{"fieldKey":"shipping_state","label":"State / County","placeholder":"State / County"},"label":"Shipping: State / County"},{"id":"015de0","name":"woocommerce-form-field","parent":"jklwty","children":[],"settings":{"fieldKey":"shipping_postcode","label":"Postcode / ZIP","placeholder":"Postcode / ZIP"},"label":"Shipping: Postcode / ZIP"},{"id":"c383d3","name":"text-basic","parent":"jklwty","children":[],"settings":{"text":"{do_action:woocommerce_after_checkout_shipping_form}"},"label":"woocommerce_after_checkout_shipping_form"},{"id":"29aae0","name":"text-basic","parent":"1ea0b0","children":[],"settings":{"text":"{do_action:woocommerce_checkout_after_customer_details}"},"label":"woocommerce_checkout_after_customer_details"}]}