{"id":"complete-edit-address-block","label":"Complete edit address block","target":{"generatorType":"woocommerce","generatorPage":"myaccount","generatorArea":"state-edit-address"},"content":[{"id":"81a5e8","name":"woocommerce-notice","parent":"axmhvq","children":[],"settings":{"previewType":"all"},"label":"WooCommerce notice"},{"id":"d06a2c","name":"text-basic","parent":"axmhvq","children":[],"settings":{"text":"{do_action:woocommerce_before_edit_account_address_form}"},"label":"woocommerce_before_edit_account_address_form"},{"id":"f8d8ad","name":"woocommerce-account-edit-address-form","parent":"axmhvq","children":["c1d8ce","2172fb"],"settings":{},"label":"Edit address form"},{"id":"c1d8ce","name":"heading","parent":"f8d8ad","children":[],"settings":{"text":"{woo_account_edit_address_title}","tag":"h2"},"label":"Edit address title"},{"id":"2172fb","name":"div","parent":"f8d8ad","children":["d73011","f124f6","4424eb","vkmugw"],"settings":{"_cssClasses":"woocommerce-address-fields","_alignItems":"stretch","_rowGap":"1rem"},"label":"Address fields"},{"id":"d73011","name":"text-basic","parent":"2172fb","children":[],"settings":{"text":"{do_action:woocommerce_before_edit_address_form}"},"label":"woocommerce_before_edit_address_form"},{"id":"f124f6","name":"div","parent":"2172fb","children":["3c647c","09b6a2","1538bb","c252e4","4444b3","082b36","335590","19fc56","2e0dea","300b85"],"settings":{"_cssClasses":"woocommerce-address-fields__field-wrapper","_display":"flex","_flexWrap":"wrap","_justifyContent":"space-between","_alignItems":"stretch","_alignSelf":"stretch"},"label":"Address field wrapper"},{"id":"3c647c","name":"woocommerce-form-field","parent":"f124f6","children":[],"settings":{"fieldSource":"accountEditAddress","fieldKey":"first_name","label":"First name","placeholder":"First name","disableRowFirstLast":true},"label":"Address: First name"},{"id":"09b6a2","name":"woocommerce-form-field","parent":"f124f6","children":[],"settings":{"fieldSource":"accountEditAddress","fieldKey":"last_name","label":"Last name","placeholder":"Last name","disableRowFirstLast":true},"label":"Address: Last name"},{"id":"1538bb","name":"woocommerce-form-field","parent":"f124f6","children":[],"settings":{"fieldSource":"accountEditAddress","fieldKey":"country","label":"Country / Region","placeholder":"Country / Region","disableRowFirstLast":true},"label":"Address: Country / Region"},{"id":"c252e4","name":"woocommerce-form-field","parent":"f124f6","children":[],"settings":{"fieldSource":"accountEditAddress","fieldKey":"address_1","label":"Street address","placeholder":"House number and street name","disableRowFirstLast":true},"label":"Address: Street address"},{"id":"4444b3","name":"woocommerce-form-field","parent":"f124f6","children":[],"settings":{"fieldSource":"accountEditAddress","fieldKey":"address_2","label":"Apartment, suite, unit, etc.","placeholder":"Apartment, suite, unit, etc. (optional)","disableRowFirstLast":true},"label":"Address: Apartment, suite, unit, etc."},{"id":"082b36","name":"woocommerce-form-field","parent":"f124f6","children":[],"settings":{"fieldSource":"accountEditAddress","fieldKey":"city","label":"Town / City","placeholder":"Town / City","disableRowFirstLast":true},"label":"Address: Town / City"},{"id":"335590","name":"woocommerce-form-field","parent":"f124f6","children":[],"settings":{"fieldSource":"accountEditAddress","fieldKey":"state","label":"State / County","placeholder":"State / County","disableRowFirstLast":true},"label":"Address: State / County"},{"id":"19fc56","name":"woocommerce-form-field","parent":"f124f6","children":[],"settings":{"fieldSource":"accountEditAddress","fieldKey":"postcode","label":"Postcode / ZIP","placeholder":"Postcode / ZIP","disableRowFirstLast":true},"label":"Address: Postcode / ZIP"},{"id":"2e0dea","name":"woocommerce-form-field","parent":"f124f6","children":[],"settings":{"fieldSource":"accountEditAddress","fieldKey":"phone","label":"Phone","placeholder":"Phone","disableRowFirstLast":true},"label":"Address: Phone"},{"id":"300b85","name":"woocommerce-form-field","parent":"f124f6","children":[],"settings":{"fieldSource":"accountEditAddress","fieldKey":"email","label":"Email address","placeholder":"Email address","disableRowFirstLast":true},"label":"Address: Email address"},{"id":"4424eb","name":"text-basic","parent":"2172fb","children":[],"settings":{"text":"{do_action:woocommerce_after_edit_address_form}"},"label":"woocommerce_after_edit_address_form"},{"id":"vkmugw","name":"woocommerce-form-submit","parent":"2172fb","children":[],"settings":{"formType":"editAddress","buttonText":"Save address"},"label":"Save address"},{"id":"d066b0","name":"text-basic","parent":"axmhvq","children":[],"settings":{"text":"{do_action:woocommerce_after_edit_account_address_form}"},"label":"woocommerce_after_edit_account_address_form"}]}