{"id":"additional-fields","label":"Additional fields","target":{"generatorType":"woocommerce","generatorPage":"checkout","generatorArea":"state-checkout"},"content":[{"id":"3a6853","name":"block","parent":"ipioeb","children":["bae585","d1c31e","1f8258"],"settings":{"_margin":{"top":"1rem"},"_alignItems":"stretch","_rowGap":"1rem"},"label":"Additional Fields"},{"id":"bae585","name":"text-basic","parent":"3a6853","children":[],"settings":{"text":"{do_action:woocommerce_before_order_notes}"},"label":"woocommerce_before_order_notes"},{"id":"d1c31e","name":"woocommerce-form-field","parent":"3a6853","children":[],"settings":{"fieldKey":"order_comments","label":"Order notes","placeholder":"Notes about your order, e.g. special notes for delivery."},"label":"Additional: Order notes"},{"id":"1f8258","name":"text-basic","parent":"3a6853","children":[],"settings":{"text":"{do_action:woocommerce_after_order_notes}"},"label":"woocommerce_after_order_notes"}]}