{"id":"complete-add-payment-method-block","label":"Complete add payment method block","target":{"generatorType":"woocommerce","generatorPage":"myaccount","generatorArea":"state-add-payment-method"},"content":[{"id":"lratwd","name":"woocommerce-account-add-payment-method","parent":"ysinpg","children":[],"settings":{}}]}