{"id":"complete-downloads-block","label":"Complete downloads block","target":{"generatorType":"woocommerce","generatorPage":"myaccount","generatorArea":"state-downloads"},"content":[{"id":"7f6908","name":"text-basic","parent":"3b2865","children":[],"settings":{"text":"{do_action:woocommerce_before_account_downloads}"},"label":"woocommerce_before_account_downloads"},{"id":"ec5c33","name":"block","parent":"3b2865","children":["2727ef","26163f","6030e7","f3e996"],"settings":{"_conditions":[[{"id":"hasdls","key":"dynamic_data","dynamic_data":"{query_results_count:6030e7}","compare":">","value":"0"}]],"_alignItems":"stretch","_rowGap":"1rem","_margin":{"top":"1rem"},"_padding":{"bottom":"1rem"}},"label":"Download list"},{"id":"2727ef","name":"text-basic","parent":"ec5c33","children":[],"settings":{"text":"{do_action:woocommerce_before_available_downloads}"},"label":"woocommerce_before_available_downloads"},{"id":"26163f","name":"text-basic","parent":"ec5c33","children":[],"settings":{"text":"{do_action:woocommerce_available_downloads}"},"label":"woocommerce_available_downloads"},{"id":"6030e7","name":"block","parent":"ec5c33","children":["cb0c8d"],"settings":{"hasLoop":true,"query":{"objectType":"wooAccountDownloads"},"_alignItems":"stretch","_position":"relative","_rowGap":"1rem"},"label":"Download items loop"},{"id":"cb0c8d","name":"div","parent":"6030e7","children":["f3d7b7","993438"],"settings":{"_display":"flex","_alignSelf":"stretch","_columnGap":"1.5rem","_rowGap":"1rem","_justifyContent":"space-between","_padding":{"top":"1rem","right":"1rem","bottom":"1rem","left":"1rem"},"_background":{"color":{"raw":"hsl(0, 0%, 98%)"}},"_flexWrap":"wrap"},"label":"Download row"},{"id":"f3d7b7","name":"div","parent":"cb0c8d","children":["e8ea09","a0ac24","f226bd"],"settings":{"_display":"flex","_direction":"column","_flexGrow":"1","_flexShrink":"1","_flexBasis":"0"},"label":"Download details wrapper"},{"id":"e8ea09","name":"text-basic","parent":"f3d7b7","children":[],"settings":{"text":"Product: {woo_order_download_product}"},"label":"Product"},{"id":"a0ac24","name":"text-basic","parent":"f3d7b7","children":[],"settings":{"text":"Downloads remaining: {woo_order_downloads_remaining}"},"label":"Downloads remaining"},{"id":"f226bd","name":"text-basic","parent":"f3d7b7","children":[],"settings":{"text":"Expires: {woo_order_download_access_expires}"},"label":"Expires"},{"id":"993438","name":"div","parent":"cb0c8d","children":["887089"],"settings":{"_alignItems":"flex-end","_justifyContent":"center","_width":"auto"},"label":"Download action wrapper"},{"id":"887089","name":"button","parent":"993438","children":[],"settings":{"style":"dark","link":{"type":"external","url":"{woo_order_download_url}"},"text":"{woo_order_download_name}"},"label":"Download button"},{"id":"f3e996","name":"text-basic","parent":"ec5c33","children":[],"settings":{"text":"{do_action:woocommerce_after_available_downloads}"},"label":"woocommerce_after_available_downloads"},{"id":"287233","name":"block","parent":"3b2865","children":["70bcb3","468531"],"settings":{"_conditions":[[{"id":"nodl","key":"dynamic_data","dynamic_data":"{query_results_count:6030e7}","compare":"==","value":"0"}]],"_padding":{"top":"1rem","right":"1rem","bottom":"1rem","left":"1rem"}},"label":"Empty downloads"},{"id":"70bcb3","name":"text-basic","parent":"287233","children":[],"settings":{"text":"No downloads available yet."},"label":"Empty message"},{"id":"468531","name":"button","parent":"287233","children":[],"settings":{"text":"Browse products","style":"primary","link":{"type":"external","url":"{woo_url:shop}"}},"label":"Browse products"},{"id":"2812e9","name":"text-basic","parent":"3b2865","children":[],"settings":{"text":"{do_action:woocommerce_after_account_downloads}"},"label":"woocommerce_after_account_downloads"}]}