{"id":"payment-options","label":"Payment options","target":{"generatorType":"woocommerce","generatorPage":"checkout","generatorArea":"state-checkout"},"content":[{"id":"9277ca","name":"block","parent":"ipioeb","children":["263f35","66dad1","daa2cf","c7240c"],"settings":{"_margin":{"top":"1rem"},"_alignSelf":"stretch","_alignItems":"stretch","_rowGap":"1rem"},"label":"Payment Options"},{"id":"263f35","name":"heading","parent":"9277ca","children":[],"settings":{"text":"Payment options"}},{"id":"66dad1","name":"text-basic","parent":"9277ca","children":[],"settings":{"text":"{do_action:woocommerce_review_order_before_payment}"},"label":"woocommerce_review_order_before_payment"},{"id":"daa2cf","name":"woocommerce-payment-options","parent":"9277ca","children":[],"settings":{},"label":"Payment options"},{"id":"c7240c","name":"text-basic","parent":"9277ca","children":[],"settings":{"text":"{do_action:woocommerce_review_order_after_payment}"},"label":"woocommerce_review_order_after_payment"}]}