{"id":"place-order","label":"Place order","target":{"generatorType":"woocommerce","generatorPage":"checkout","generatorArea":"state-checkout"},"content":[{"id":"db288d","name":"block","parent":"ipioeb","children":["45bfb3","e214dd","1d8d68","349beb","fcbfb2","0cfc72","4bd029"],"settings":{"_margin":{"top":"1rem"}},"label":"Place Order"},{"id":"45bfb3","name":"text-basic","parent":"db288d","children":[],"settings":{"text":"{do_action:woocommerce_checkout_before_terms_and_conditions}"},"label":"woocommerce_checkout_before_terms_and_conditions"},{"id":"e214dd","name":"text-basic","parent":"db288d","children":[],"settings":{"text":"{do_action:woocommerce_checkout_terms_and_conditions}"},"label":"woocommerce_checkout_terms_and_conditions"},{"id":"1d8d68","name":"form-checkbox","parent":"db288d","children":[],"settings":{"_cssClasses":"validate-required","wooFields":"terms"},"label":"Terms"},{"id":"349beb","name":"text-basic","parent":"db288d","children":[],"settings":{"text":"{do_action:woocommerce_checkout_after_terms_and_conditions}"},"label":"woocommerce_checkout_after_terms_and_conditions"},{"id":"fcbfb2","name":"text-basic","parent":"db288d","children":[],"settings":{"text":"{do_action:woocommerce_review_order_before_submit}"},"label":"woocommerce_review_order_before_submit"},{"id":"0cfc72","name":"woocommerce-checkout-place-order","parent":"db288d","children":[],"settings":{"_margin":{"left":"auto"}},"label":"Place order"},{"id":"4bd029","name":"text-basic","parent":"db288d","children":[],"settings":{"text":"{do_action:woocommerce_review_order_after_submit}"},"label":"woocommerce_review_order_after_submit"}]}