{"id":"complete-reset-password-block","label":"Complete reset password block","target":{"generatorType":"woocommerce","generatorPage":"myaccount","generatorArea":"state-reset-password"},"content":[{"id":"024002","name":"woocommerce-notice","parent":"fdwikq","children":[],"settings":{"previewType":"all"},"label":"WooCommerce notice"},{"id":"a42aab","name":"text-basic","parent":"fdwikq","children":[],"settings":{"text":"{do_action:woocommerce_before_reset_password_form}"},"label":"woocommerce_before_reset_password_form"},{"id":"9b3490","name":"woocommerce-account-reset-password-form","parent":"fdwikq","children":["59dc17","d4c4be","678a66","2a51e6","78ce8e"],"settings":{"_alignItems":"stretch","_rowGap":"1rem"},"label":"Reset password form"},{"id":"59dc17","name":"text-basic","parent":"9b3490","children":[],"settings":{"text":"Enter a new password below."},"label":"Reset password message"},{"id":"d4c4be","name":"woocommerce-form-field","parent":"9b3490","children":[],"settings":{"fieldSource":"accountResetPassword","fieldKey":"password_1","label":"New password"},"label":"Reset password: New password"},{"id":"678a66","name":"woocommerce-form-field","parent":"9b3490","children":[],"settings":{"fieldSource":"accountResetPassword","fieldKey":"password_2","label":"Re-enter new password"},"label":"Reset password: Re-enter new password"},{"id":"2a51e6","name":"text-basic","parent":"9b3490","children":[],"settings":{"text":"{do_action:woocommerce_resetpassword_form}"},"label":"woocommerce_resetpassword_form"},{"id":"78ce8e","name":"woocommerce-form-submit","parent":"9b3490","children":[],"settings":{"formType":"resetPassword","buttonText":"Save"},"label":"Save"},{"id":"334449","name":"text-basic","parent":"fdwikq","children":[],"settings":{"text":"{do_action:woocommerce_after_reset_password_form}"},"label":"woocommerce_after_reset_password_form"}]}