{"id":"free-shipping-progress","label":"Free shipping progress","target":{"generatorType":"woocommerce","generatorPage":"dynamic-fragment","generatorArea":"content"},"content":[{"id":"da5856","name":"progress-bar","children":[],"settings":{"bars":[{"title":"Add {woo_free_shipping_remaining} more for free shipping","id":"gxvgge","percentage":"{woo_free_shipping_progress:value}","color":{"raw":"hsl(0, 0%, 20%)"}}],"showPercentage":true,"labelTypography":{"color":{"raw":"hsl(0, 0%, 20%)"}},"percentageTypography":{"color":{"raw":"hsl(0, 0%, 20%)"}},"_conditions":[[{"id":"wrlpyr","key":"dynamic_data","dynamic_data":"{woo_free_shipping_min_amount:value}","compare":"!=","value":"0"},{"id":"xszggr","key":"dynamic_data","dynamic_data":"{woo_free_shipping_progress:value}","compare":"<","value":"100"}]]},"label":"Free shipping progress bar","parent":"997ef3"}]}