{"id":"complete-empty-block","label":"Complete empty block","target":{"generatorType":"woocommerce","generatorPage":"cart","generatorArea":"state-empty"},"content":[{"id":"buwueh","name":"block","parent":"hmxdvu","children":["vleuxc","qnpbkx"],"settings":{"_heightMin":"50vh","_display":"flex","_alignItems":"center","_justifyContent":"center"},"label":"Content"},{"id":"vleuxc","name":"text-basic","parent":"buwueh","children":[],"settings":{"text":"Your cart is currently empty."},"label":"Cart empty text"},{"id":"qnpbkx","name":"button","parent":"buwueh","children":[],"settings":{"style":"primary","text":"Return to shop","link":{"type":"external","url":"{woo_url:shop}"}},"label":"Shop button"}]}