{"id":"complete-payment-methods-block","label":"Complete payment methods block","target":{"generatorType":"woocommerce","generatorPage":"myaccount","generatorArea":"state-payment-methods"},"content":[{"id":"mrebae","name":"woocommerce-account-payment-methods","parent":"wounhq","children":[],"settings":{}}]}