{"id":"complete-lost-password-block","label":"Complete lost password block","target":{"generatorType":"woocommerce","generatorPage":"myaccount","generatorArea":"state-lost-password"},"content":[{"id":"11d4e2","name":"woocommerce-notice","parent":"hwzato","children":[],"settings":{"previewType":"all"},"label":"WooCommerce notice"},{"id":"1a9151","name":"text-basic","parent":"hwzato","children":[],"settings":{"text":"{do_action:woocommerce_before_lost_password_form}"},"label":"woocommerce_before_lost_password_form"},{"id":"78faba","name":"woocommerce-account-lost-password-form","parent":"hwzato","children":["f592f2","adf76b","037237","bbaf0c"],"settings":{"_alignItems":"stretch","_rowGap":"1rem"},"label":"Lost password form"},{"id":"f592f2","name":"text-basic","parent":"78faba","children":[],"settings":{"text":"Lost your password? Please enter your username or email address. You will receive a link to create a new password via email."},"label":"Lost password message"},{"id":"adf76b","name":"woocommerce-form-field","parent":"78faba","children":[],"settings":{"fieldSource":"accountLostPassword","fieldKey":"user_login","label":"Username or email"},"label":"Lost password: Username or email"},{"id":"037237","name":"text-basic","parent":"78faba","children":[],"settings":{"text":"{do_action:woocommerce_lostpassword_form}"},"label":"woocommerce_lostpassword_form"},{"id":"bbaf0c","name":"woocommerce-form-submit","parent":"78faba","children":[],"settings":{"formType":"lostPassword","buttonText":"Reset password"},"label":"Reset password"},{"id":"db0337","name":"text-basic","parent":"hwzato","children":[],"settings":{"text":"{do_action:woocommerce_after_lost_password_form}"},"label":"woocommerce_after_lost_password_form"}]}