{"id":"complete-dashboard-block","label":"Complete dashboard block","target":{"generatorType":"woocommerce","generatorPage":"myaccount","generatorArea":"state-dashboard"},"content":[{"id":"ayquoi","name":"woocommerce-notice","parent":"zxenag","children":[],"settings":{"previewType":"all"}},{"id":"rjhwuj","name":"text-basic","parent":"zxenag","children":[],"settings":{"text":"Hello! {wp_user_display_name},<br>From your account dashboard you can view your recent orders, manage your shipping and billing addresses, and edit your password and account details."},"label":"Welcome message"}]}