{"id":"complete-login-block","label":"Complete login block","target":{"generatorType":"woocommerce","generatorPage":"myaccount","generatorArea":"state-login"},"content":[{"id":"22d57d","name":"woocommerce-notice","parent":"zvnpen","children":[],"settings":{"previewType":"all"},"label":"WooCommerce notice"},{"id":"ec22c3","name":"text-basic","parent":"zvnpen","children":[],"settings":{"text":"{do_action:woocommerce_before_customer_login_form}"},"label":"woocommerce_before_customer_login_form"},{"id":"fbc0ff","name":"block","parent":"zvnpen","children":["157bf5","f0edc8"],"settings":{"_columnGap":"2rem","_gridGap":"2rem","_gridTemplateColumns":"1fr 1fr","_display":"grid","_gridTemplateColumns:mobile_landscape":"1fr"},"label":"Login content"},{"id":"157bf5","name":"woocommerce-account-login-form","parent":"fbc0ff","children":["693f89","2f6304","120cb7","4bef9c","7e88e3","9d24c3","7b81f8","999440","4c7777"],"settings":{"_alignItems":"stretch","_rowGap":"1rem"},"label":"Login form"},{"id":"693f89","name":"heading","parent":"157bf5","children":[],"settings":{"text":"Login"}},{"id":"2f6304","name":"text-basic","parent":"157bf5","children":[],"settings":{"text":"{do_action:woocommerce_login_form_start}"},"label":"woocommerce_login_form_start"},{"id":"120cb7","name":"woocommerce-form-field","parent":"157bf5","children":[],"settings":{"fieldSource":"accountLogin","fieldKey":"username","label":"Username or email address"},"label":"Login: Username or email"},{"id":"4bef9c","name":"woocommerce-form-field","parent":"157bf5","children":[],"settings":{"fieldSource":"accountLogin","fieldKey":"password","label":"Password"},"label":"Login: Password"},{"id":"7e88e3","name":"text-basic","parent":"157bf5","children":[],"settings":{"text":"{do_action:woocommerce_login_form}"},"label":"woocommerce_login_form"},{"id":"9d24c3","name":"form-checkbox","parent":"157bf5","children":[],"settings":{"wooFields":"accountLoginRememberMe","text":"Remember me"},"label":"Remember me"},{"id":"7b81f8","name":"woocommerce-form-submit","parent":"157bf5","children":[],"settings":{"formType":"login","buttonText":"Log in"},"label":"Log in"},{"id":"999440","name":"text-basic","parent":"157bf5","children":[],"settings":{"text":"<a href=\"{woo_url:lost-password}\">Lost your password?</a>","_cssClasses":"woocommerce-LostPassword lost_password"},"label":"Lost password link"},{"id":"4c7777","name":"text-basic","parent":"157bf5","children":[],"settings":{"text":"{do_action:woocommerce_login_form_end}"},"label":"woocommerce_login_form_end"},{"id":"f0edc8","name":"woocommerce-account-register-form","parent":"fbc0ff","children":["f1452f","822c01","cc391c","2a0dd9","2d6b96","535341","ab8540","5d1af7"],"settings":{"_alignItems":"stretch","_rowGap":"1rem"},"label":"Register form"},{"id":"f1452f","name":"heading","parent":"f0edc8","children":[],"settings":{"text":"Register"}},{"id":"822c01","name":"text-basic","parent":"f0edc8","children":[],"settings":{"text":"{do_action:woocommerce_register_form_start}"},"label":"woocommerce_register_form_start"},{"id":"cc391c","name":"woocommerce-form-field","parent":"f0edc8","children":[],"settings":{"fieldSource":"accountRegister","fieldKey":"username","label":"Username"},"label":"Register: Username"},{"id":"2a0dd9","name":"woocommerce-form-field","parent":"f0edc8","children":[],"settings":{"fieldSource":"accountRegister","fieldKey":"email","label":"Email address"},"label":"Register: Email address"},{"id":"2d6b96","name":"woocommerce-form-field","parent":"f0edc8","children":[],"settings":{"fieldSource":"accountRegister","fieldKey":"password","label":"Password"},"label":"Register: Password"},{"id":"535341","name":"text-basic","parent":"f0edc8","children":[],"settings":{"text":"{do_action:woocommerce_register_form}"},"label":"woocommerce_register_form"},{"id":"ab8540","name":"woocommerce-form-submit","parent":"f0edc8","children":[],"settings":{"formType":"register","buttonText":"Register"},"label":"Register"},{"id":"5d1af7","name":"text-basic","parent":"f0edc8","children":[],"settings":{"text":"{do_action:woocommerce_register_form_end}"},"label":"woocommerce_register_form_end"},{"id":"cb4984","name":"text-basic","parent":"zvnpen","children":[],"settings":{"text":"{do_action:woocommerce_after_customer_login_form}"},"label":"woocommerce_after_customer_login_form"}]}