{"id":"complete-edit-account-block","label":"Complete edit account block","target":{"generatorType":"woocommerce","generatorPage":"myaccount","generatorArea":"state-edit-account"},"content":[{"id":"87d6a8","name":"woocommerce-notice","parent":"ylutdr","children":[],"settings":{"previewType":"all"},"label":"WooCommerce notice"},{"id":"ea834d","name":"text-basic","parent":"ylutdr","children":[],"settings":{"text":"{do_action:woocommerce_before_edit_account_form}"},"label":"woocommerce_before_edit_account_form"},{"id":"4cdcc4","name":"woocommerce-account-edit-account-form","parent":"ylutdr","children":["eee6e5","475247","d21cfe","0c55de","854844","izzoah","727c90"],"settings":{"_alignItems":"stretch","_rowGap":"1rem"},"label":"Edit account form"},{"id":"eee6e5","name":"text-basic","parent":"4cdcc4","children":[],"settings":{"text":"{do_action:woocommerce_edit_account_form_start}"},"label":"woocommerce_edit_account_form_start"},{"id":"475247","name":"div","parent":"4cdcc4","children":["6ce60a","aaa929","e9bed1","98bcb3"],"settings":{"_display":"flex","_flexWrap":"wrap","_alignItems":"stretch","_alignSelf":"stretch"},"label":"Account fields"},{"id":"6ce60a","name":"woocommerce-form-field","parent":"475247","children":[],"settings":{"fieldSource":"accountEditAccount","fieldKey":"account_first_name","label":"First name","placeholder":" "},"label":"Account: First name"},{"id":"aaa929","name":"woocommerce-form-field","parent":"475247","children":[],"settings":{"fieldSource":"accountEditAccount","fieldKey":"account_last_name","label":"Last name","placeholder":" "},"label":"Account: Last name"},{"id":"e9bed1","name":"woocommerce-form-field","parent":"475247","children":[],"settings":{"fieldSource":"accountEditAccount","fieldKey":"account_display_name","label":"Display name","placeholder":" "},"label":"Account: Display name"},{"id":"98bcb3","name":"woocommerce-form-field","parent":"475247","children":[],"settings":{"fieldSource":"accountEditAccount","fieldKey":"account_email","label":"Email address","placeholder":" "},"label":"Account: Email address"},{"id":"d21cfe","name":"text-basic","parent":"4cdcc4","children":[],"settings":{"text":"{do_action:woocommerce_edit_account_form_fields}"},"label":"woocommerce_edit_account_form_fields"},{"id":"0c55de","name":"block","parent":"4cdcc4","children":["506d99","4fec51","d7d86d","1ea7f0"],"settings":{"tag":"custom","customTag":"fieldset","_alignSelf":"stretch","_rowGap":"1rem"},"label":"Password fieldset"},{"id":"506d99","name":"text-basic","parent":"0c55de","children":[],"settings":{"text":"Password change","tag":"custom","customTag":"legend"},"label":"Password legend"},{"id":"4fec51","name":"woocommerce-form-field","parent":"0c55de","children":[],"settings":{"fieldSource":"accountEditAccount","fieldKey":"password_current","label":"Current password (leave blank to leave unchanged)","placeholder":" "},"label":"Account: Current password"},{"id":"d7d86d","name":"woocommerce-form-field","parent":"0c55de","children":[],"settings":{"fieldSource":"accountEditAccount","fieldKey":"password_1","label":"New password (leave blank to leave unchanged)","placeholder":" "},"label":"Account: New password"},{"id":"1ea7f0","name":"woocommerce-form-field","parent":"0c55de","children":[],"settings":{"fieldSource":"accountEditAccount","fieldKey":"password_2","label":"Confirm new password","placeholder":" "},"label":"Account: Confirm new password"},{"id":"854844","name":"text-basic","parent":"4cdcc4","children":[],"settings":{"text":"{do_action:woocommerce_edit_account_form}"},"label":"woocommerce_edit_account_form"},{"id":"izzoah","name":"woocommerce-form-submit","parent":"4cdcc4","children":[],"settings":{"formType":"editAccount","buttonText":"Save changes"},"label":"Save changes"},{"id":"727c90","name":"text-basic","parent":"4cdcc4","children":[],"settings":{"text":"{do_action:woocommerce_edit_account_form_end}"},"label":"woocommerce_edit_account_form_end"},{"id":"77eebe","name":"text-basic","parent":"ylutdr","children":[],"settings":{"text":"{do_action:woocommerce_after_edit_account_form}"},"label":"woocommerce_after_edit_account_form"}]}