{"id":"complete-receipt-block","label":"Complete receipt block","target":{"generatorType":"woocommerce","generatorPage":"checkout","generatorArea":"state-receipt"},"content":[{"id":"090261","name":"block","parent":"eobrhy","children":["lqvyqr","334efc","882f8d","2da399","c8f1c1","1d7aeb"],"settings":{},"label":"Order details"},{"id":"lqvyqr","name":"woocommerce-notice","parent":"090261","children":[],"settings":{"previewType":"all"}},{"id":"334efc","name":"text-basic","parent":"090261","children":[],"settings":{"text":"Order number: {woo_order_id}"},"label":"Order number"},{"id":"882f8d","name":"text-basic","parent":"090261","children":[],"settings":{"text":"Date: {woo_order_date}"},"label":"Date"},{"id":"2da399","name":"text-basic","parent":"090261","children":[],"settings":{"text":"Total: {woo_order_total}"},"label":"Total"},{"id":"c8f1c1","name":"text-basic","parent":"090261","children":[],"settings":{"text":"Payment method: {woo_order_payment_title}"},"label":"Payment method"},{"id":"1d7aeb","name":"text-basic","parent":"090261","children":[],"settings":{"text":"{do_action:woocommerce_receipt_payment_method}"},"label":"woocommerce_receipt_payment_method"}]}